file_name,uni,wylie,url,dept,grade,char_len,audio_len,path,inf
STT_MV0041_0217_1494109_to_1501908,ཁ་ལག་ཞིམ་པོ་འདི་འདྲའི་རྟག་པར་ར་ཞིག་ཟ་ཡ་ཡོད་མ་རེད་དོ། འཕྲོ་བརླག་མ་གཏོང་། འདི་ལས་ང་རང་གཉིས་ཟ་དོ།  ,kha lag zhim po 'di 'dra'i rtag par ra zhig za ya yod ma red do/_'phro brlag ma gtong /_'di las nga rang gnyis za do/__,https://d38pmlk0v88drf.cloudfront.net/wav16k/STT_MV0041_0217_1494109_to_1501908.wav,STT_MV,3,96,7.799,wav16k/STT_MV0041_0217_1494109_to_1501908.wav,ཁ་ལག་ཞིམ་པོ་དེ་འདྲས་རྟག་པར་ར་ཞིག་ཟ་ཡ་ཡོད་མ་རེད་དོ། འཕྲོ་བརླག་མ་གཏོང་། དེ་ལས་ང་རང་གཉིས་ཟ་དོ།
STT_MV0041_0198_1371975_to_1381859,དགེ་ཕྲུག་དང་དགེ་རྒན་སེམས་པ་མཐུན་པས་མ་ཚད། དགེ་རྒན་དང་ཨ་ཅག་ལགས་སེམས་པ་གཅིག་མཐུན་རེད་པ། ཨེ་ནས། དགེ་ཕྲུག་དང་ཨ་ཅག་ལགས་སེམས་པ་མཐུན་དགོས་བྱུང་། ཨེ།  ,dge phrug dang dge rgan sems pa mthun pas ma tshad/_dge rgan dang a cag lags sems pa gcig mthun red pa/_e nas/_dge phrug dang a cag lags sems pa mthun dgos byung /_e/__,https://d38pmlk0v88drf.cloudfront.net/wav16k/STT_MV0041_0198_1371975_to_1381859.wav,STT_MV,3,142,9.884,wav16k/STT_MV0041_0198_1371975_to_1381859.wav,དགེ་ཕྲུག་དང་དགེ་རྒན་སེམས་པ་མཐུན་པས་མ་ཚད། དགེ་རྒན་དང་ཨ་ཅག་ལགས་སེམས་པ་གཅིག་མཐུན་རེད་པ། ཨེ་ནས་དགེ་ཕྲུག་དང་ཨ་ཅག་ལགས་སེམས་པ་མཐུན་དགོས་བྱུང་།
STT_MV0041_0199_1381859_to_1389523,ཨ་ཙི། ཨ་ཚ་ ཚ་ ཚ་ མགྱོགས་སེ་རྒྱུགས ཟ་ཁང་ཕྱིན་རྗེས་རྒན་ལགས་ཚུར་སྐད་གཏང་ཤོག ལགས་སོ། ཨ་ཅག་ལགས། ཁོང་ལ་སྡུག་ཚོད་ཟིམ་བྱས། ལམ་སང་ལོག་ཤོག་ལོབས ,a tsi/_a tsha _tsha _tsha _mgyogs se rgyugs_za khang phyin rjes rgan lags tshur skad gtang shog_lags so/_a cag lags/_khong la sdug tshod zim byas/_lam sang log shog lobs_,https://d38pmlk0v88drf.cloudfront.net/wav16k/STT_MV0041_0199_1381859_to_1389523.wav,STT_MV,3,134,7.664,wav16k/STT_MV0041_0199_1381859_to_1389523.wav,ཨ་ཙི། ་། མགྱོགས་སེ་རྒྱུགས། ཟ་ཁང་ལ་ཕྱིན་བྱས། ལ་སེ། རྒན་ལགས་ཚུར་སྐད་གཏོང་ཤོག ཁོང་ལ་རྡོག་ཚོད་ཟིམ་བྱས་ལམ་སང་ལོག་ཤོག་ལོབས།
STT_MV0041_0213_1469224_to_1472334,ལྟོ་ཁ་གང་ཟ་མ་བཅུག་པ། རྩིས་བསྐྱོན་པ་ཡིན་ན། ཨེ་ནས།  ,lto kha gang za ma bcug pa/_rtsis bskyon pa yin na/_e nas/__,https://d38pmlk0v88drf.cloudfront.net/wav16k/STT_MV0041_0213_1469224_to_1472334.wav,STT_MV,3,50,3.11,wav16k/STT_MV0041_0213_1469224_to_1472334.wav,ལྟོ་ཁ་གང་ཟ་མ་བཅུག་པར་རྩིས་སྐྱོན་པ་ཡིན་ན། ཨེ་ནས།
STT_TT00730_0202_1044561_to_1047889,ད་ལྟ་ངས་ཞུ་ཡ་དེ། ད་སྒྲུབ་པ་སྙིང་པོར་མཛད་པ་ཟེར་ཡ་ད་ཚིག་དེ།  ,da lta ngas zhu ya de/_da sgrub pa snying por mdzad pa zer ya da tshig de/__,https://d38pmlk0v88drf.cloudfront.net/wav16k/STT_TT00730_0202_1044561_to_1047889.wav,STT_TT,3,59,3.328,wav16k/STT_TT00730_0202_1044561_to_1047889.wav,ད་ལྟ་ངས་ཞུ་ཡ་དེ། ད་སྒྲུབ་པ་སྙིང་པོར་མཛད་པ་ཟེར་ཡ་ད་ཚིག་དེ།
STT_MV0041_0224_1538299_to_1544564,ཧུན།  ,hun/__,https://d38pmlk0v88drf.cloudfront.net/wav16k/STT_MV0041_0224_1538299_to_1544564.wav,STT_MV,3,6,6.265,wav16k/STT_MV0041_0224_1538299_to_1544564.wav,ཧུན།
STT_MV0041_0225_1544564_to_1551934,ཨེ་ ཧེ། ཧུམ། སྐུ་ངོ་།  ,e _he/_hum/_sku ngo /__,https://d38pmlk0v88drf.cloudfront.net/wav16k/STT_MV0041_0225_1544564_to_1551934.wav,STT_MV,3,23,7.37,wav16k/STT_MV0041_0225_1544564_to_1551934.wav,ཨེ་་ཧེཧ། ུ སྐུ་ངོ་།
STT_MV0041_0227_1559833_to_1564648,དཀྲོག་གཏམ་འདི་འདྲས་བཟོས་བྱས། མ་གཞི་ནས་ཁྱོད་རའི་མདུན་ལ་སུ་ཡིན་མེད། ཁྱོད་རས་རྒྱུས་མེད་པེ།  ,dkrog gtam 'di 'dras bzos byas/_ma gzhi nas khyod ra'i mdun la su yin med/_khyod ras rgyus med pe/__,https://d38pmlk0v88drf.cloudfront.net/wav16k/STT_MV0041_0227_1559833_to_1564648.wav,STT_MV,3,89,4.815,wav16k/STT_MV0041_0227_1559833_to_1564648.wav,དཀྲོག་སཏོང་དེ་འདྲས་བཟོས་བྱས། མ་གཞི་ནས་ཁྱོད་རའི་མདུན་ལ་སུ་ཡིན་མིན། ཁྱོད་རས་རྒྱུས་མེད་པེ།
STT_MV0041_0203_1409411_to_1418212,ཨ་ཅག་ལགས་ལ ང་གཅིན་པ་གཏང་ཀ་ཕྱིན་སོང་ཟེར་ཞུས་ན། ད་ག་རེད་པ། ངས་ཞུས་པ་ཡིན་ན། ཡིན་ནས་ཨ་ཅག་ལགས་ཀིས་ལམ་སང་ལོག་མ་ཕེབས་ན་སྐུ་ཐང་མཉེལ་ཡོང་གསུང་གིས།  ,a cag lags la_nga gcin pa gtang ka phyin song zer zhus na/_da ga red pa/_ngas zhus pa yin na/_yin nas a cag lags kis lam sang log ma phebs na sku thang mnyel yong gsung gis/__,https://d38pmlk0v88drf.cloudfront.net/wav16k/STT_MV0041_0203_1409411_to_1418212.wav,STT_MV,3,139,8.801,wav16k/STT_MV0041_0203_1409411_to_1418212.wav,ཨ་ཅག་ལགས་ལ་ང་གཅིན་པ་གཏང་ག་ཕྱིན་སོང་ཟེར་ཞུས་ན་ད་ག་རེད་པ། ངས་ཞུས་པ་ཡིན། ཡིན་ནས་ཨ་ཅག་ལགས་ཀིས་ལམ་སང་ལོག་མ་ཕེབས་ན་སྐུ་ཐང་མཉེད་ཡོང་གསུང་གིས།
STT_MV0041_0208_1431466_to_1438712,ང་ཁྱེད་རང་མཉམ་དུ་ཨ་ཅག་ལགས་ལྗགས་རྩིས་སྐྱོན་རོགས་ཞུས་དགོས། ཨ་ཙི། ཨ་ཙི། དེ་འདྲས་མ་གནང་ད། དེ་འདྲས་མ་གནང་ད། ངས་ཐབས་ཤེས་བཏང་ཆོག ཐབས་ཤེས་བཏང་ཆོག ཨོ་ཨོ་རེད།  ,nga khyed rang mnyam du a cag lags ljags rtsis skyon rogs zhus dgos/_a tsi/_a tsi/_de 'dras ma gnang da/_de 'dras ma gnang da/_ngas thabs shes btang chog_thabs shes btang chog_o o red/__,https://d38pmlk0v88drf.cloudfront.net/wav16k/STT_MV0041_0208_1431466_to_1438712.wav,STT_MV,3,150,7.246,wav16k/STT_MV0041_0208_1431466_to_1438712.wav,ང་ཁྱེད་རང་མཉམ་དུ་ཨ་ཅག་ལགས་ལྗགས་རྩིས་སྐྱོན་རོགས་བྱེས། ཨ་ཙི། ཨ་ཙི། དེ་འདྲས་མ་གནང་ད། དེ་འདྲས་མ་གནང་ད། ངས་ཐབས་ཤེས་གཏང་ཆོག ཐབས་ཤེས་གཏང་ཆོག ཨོ ཨོ་རེད།
STT_MV0041_0226_1551934_to_1559833,ངས་བལྟས་ན། ཁྱེད་རང་གི་ཞལ་མདངས་སྐྱོ་པོ་འདི་འདྲས། ཡག་རྟགས་ཁྱོན་ནས་མི་འདུག སྙུང་གཞིའི་ཉེན་ཁ་འདུག་པ། ལགས། ཧུན། གཏེ་རྐྱལ་ཁྱོད་རས་ག་ནས་ཡིན་པ་ཨ།  ,ngas bltas na/_khyed rang gi zhal mdangs skyo po 'di 'dras/_yag rtags khyon nas mi 'dug_snyung gzhi'i nyen kha 'dug pa/_lags/_hun/_gte rkyal khyod ras ga nas yin pa a/__,https://d38pmlk0v88drf.cloudfront.net/wav16k/STT_MV0041_0226_1551934_to_1559833.wav,STT_MV,3,139,7.899,wav16k/STT_MV0041_0226_1551934_to_1559833.wav,ངས་བལྟས་ན་ཁྱེད་རང་གི་ཞལ་མདངས་སྐྱོ་པོ་དེ་འདྲས་ཡག་རྟགས་ཁྱོན་ནས་མི་འདུག སྙུང་གཞིའི་ཉེན་ཁ་འདུག་ག ལ། གཏན་སྐྱེལ་ཁྱོད་རང་ག་ནས་ཡིན་པ་ཨ།
STT_MV0041_0240_1636366_to_1644862,ངའི་མཛུབ་མོ་གཅིག་གི་ཚབ་བྱེད་ཐུབ་ཀི་མ་རེད། ད་དུང་ངའི་མཛུབ་མོར་ཁ་གཏང་ཀ་བྱས། ངའི་མཛུབ་མོ་འདིས་ཁ་ལ་ཉན་གི་འདུག་གེ་ལྟོས། བཟང་ངན་མ་ཤེས་པའི་བྱོལ་སོང་དང་ཆ་རེད་ཤག ,nga'i mdzub mo gcig gi tshab byed thub ki ma red/_da dung nga'i mdzub mor kha gtang ka byas/_nga'i mdzub mo 'dis kha la nyan gi 'dug ge ltos/_bzang ngan ma shes pa'i byol song dang cha red shag_,https://d38pmlk0v88drf.cloudfront.net/wav16k/STT_MV0041_0240_1636366_to_1644862.wav,STT_MV,3,153,8.496,wav16k/STT_MV0041_0240_1636366_to_1644862.wav,ངའི་མཛུག་གོ་གཅིག་གིས་ཚབ་བྱེད་ཐུབ་ཀི་མ་རེད། ད་དུང་ངའི་མཛུག་གུར་ཁ་གཏང་ག་བྱས། ངའི་མཛུག་གུ་དེའི་ཁ་ལ་ཉིན་པ་འདུག་གེ་ལྡོད། བཟང་ངན་མ་ཤེས་པའི་འྱོན་སོང་དང་ཆ་རེད་ཤག
STT_MV0041_0244_1657451_to_1667267,ངས་ན་ཚ་བལྟས་བྱས། སྨན་རིན་སྤྲད་མ་བྱུང་བ། ག་རེ། རྗེས་མ་རྩིས་རྒྱག་གི་ཡིན། ཧུན། གཏེ་རྐྱལ་ཁྱོད་རང་ཡིན་ན་ཀྱེ། ང་ལ་ན་ཚ་འདུག་ཟེར་ག་བྱས། ཁྱོད་རང་ན་ཚ་ཡོད་འགྲོ་ ཀྱེ།  ,ngas na tsha bltas byas/_sman rin sprad ma byung ba/_ga re/_rjes ma rtsis rgyag gi yin/_hun/_gte rkyal khyod rang yin na kye/_nga la na tsha 'dug zer ga byas/_khyod rang na tsha yod 'gro _kye/__,https://d38pmlk0v88drf.cloudfront.net/wav16k/STT_MV0041_0244_1657451_to_1667267.wav,STT_MV,3,156,9.816,wav16k/STT_MV0041_0244_1657451_to_1667267.wav,ངས་ན་ཚ་བལྟས་བྱས་སྨོན་རིན་སྤྲད་མ་བྱུང་ང་། ག་རེ་རྗེས་མ་རྩིས་རྒྱག་གི་ཡིན། ལྟད་རྐྱིལ་ཁྱོད་རང་ཡིན་ན་ཀྱེ། ང་ན་ཚ་འདུག་ཟེར་ག་བྱས། ཁྱོད་རང་ན་ཚ་ཡོད་འགྲོ་ཀྱེ།
STT_MV0041_0229_1570305_to_1577804,ཚོང་ཤག་ཅིག་ཐུག་ག་ཡོང་པ་ཡིན། ཁྱོད་རས་སྐད་ཆ་ཡག་ག་ཚིག་གཅིག་མེད་པའི་སྒང་ལ། ད་དུང་ངར་ཡ་སྨོན་ངན་རྒྱག་ག་བྱས། ངས་བྱས་ན། ཁྱེད་རང་ཤི་སྙིང་འདོད་ཀི་ཡོད་འགྲོ་ ,tshong shag cig thug ga yong pa yin/_khyod ras skad cha yag ga tshig gcig med pa'i sgang la/_da dung ngar ya smon ngan rgyag ga byas/_ngas byas na/_khyed rang shi snying 'dod ki yod 'gro _,https://d38pmlk0v88drf.cloudfront.net/wav16k/STT_MV0041_0229_1570305_to_1577804.wav,STT_MV,3,146,7.499,wav16k/STT_MV0041_0229_1570305_to_1577804.wav,ཚོང་ཤག་ཅིག་ཐུག་ག་ཡོང་པ་ཡིན། ཁྱོད་རས་སྐད་ཆ་ཡག་ག་ཚིག་གཅིག་མེད་པའི་སྒང་ལ། ད་དུང་ང་ཡ་སྨོན་ངན་རྐྱལ་ག་བྱས། ངས་བྱས་ན་ཁྱོད་རང་སྤྱི་སྙིང་འདོད་ཀི་ཡོད་འགྲོ།
STT_MV0041_0233_1593309_to_1602510,ཧུན། མ་གཞི་འདི་འདྲས་མ་བྱེད་ན་འགྲིག་གི་རེད། ཁྱེད་རས་ངར་ཡ་སྐད་ཆ་སྙན་པོ། ཚིག་ཁ་ཤས་ཤིག་བཤད་པ་ཡིན་ན། ང་ལ་ཡ་དགོངས་དག་ཐུགས་བདེན་ཞུས་པ་རྩིས་ཆོག ཨ་ལས། སྒུགས་གནང་ད།  ,hun/_ma gzhi 'di 'dras ma byed na 'grig gi red/_khyed ras ngar ya skad cha snyan po/_tshig kha shas shig bshad pa yin na/_nga la ya dgongs dag thugs bden zhus pa rtsis chog_a las/_sgugs gnang da/__,https://d38pmlk0v88drf.cloudfront.net/wav16k/STT_MV0041_0233_1593309_to_1602510.wav,STT_MV,3,156,9.201,wav16k/STT_MV0041_0233_1593309_to_1602510.wav,ཧེན། མ་གཞི་དེ་འདྲས་མ་བྱས་ན་འགྲིག་གི་རེད། ཁྱོད་རས་ང་ཡ་སྐད་ཆ་སྙན་པོ་ཚིག་ཁ་ཤས་ཤིག་བཤད་པ་ཡིན་ན། ང་ཡ་དགོངས་དག་ཐུགས་བདེན་བཞོས་པར་རྩིས་ཤོག ཨ་ལས་སྒུགས་གནང་ད།
STT_MV0041_0237_1609979_to_1619540,དེ་རིང་གཉན་བུར་སྐྱེས་བྱས། སང་ཉིན་ཁྲག་བཏོན་མ་ཐུབ་པ་ཡིན་ན། ཉིན་མ་གནངས་ཉིན་ག་ཟེར་དུས། ཁྲག་རྩ་འཐེབ་བྱས། ཁོག་པའི་ནང་ལ་ཡར་དེད་འགྲོ་གི་རེད།  ,de ring gnyan bur skyes byas/_sang nyin khrag bton ma thub pa yin na/_nyin ma gnangs nyin ga zer dus/_khrag rtsa 'theb byas/_khog pa'i nang la yar ded 'gro gi red/__,https://d38pmlk0v88drf.cloudfront.net/wav16k/STT_MV0041_0237_1609979_to_1619540.wav,STT_MV,3,134,9.561,wav16k/STT_MV0041_0237_1609979_to_1619540.wav,དེ་རིང་གཉིམ་བུར་སྐྱེས་བྱས་ སང་ཉིན་ཁྲག་བཏོན་མ་ཐུབ་པ་ཡིན་ན། ཉིན་མ་གནངས་ཉིན་ག་ཟེར་དུས་ ཁྲག་རྩ་ཐེབས་བྱས་ཁོག་པའི་ནང་ལ་ཡར་དེད་འགྲོ་གི་རེད།
STT_MV0041_0239_1629539_to_1636366,སྐུ་ངོ་ངའི་མཛུབ་མོ་འདི་ལ་གཅིག་ལྟོས་ད། ཉིན་ལྟར་རེ་བཞིན་བསྡོམས་རྩིས་འཐེན་རྩིས་བརྒྱབ་བྱས་གསེར་ཟངས་ཁྲི་མང་པོ་བསྡུ་གི་ཡོད་རེད། ཁྱོད་རང་སྡུག་སྲོག་འདི།  ,sku ngo nga'i mdzub mo 'di la gcig ltos da/_nyin ltar re bzhin bsdoms rtsis 'then rtsis brgyab byas gser zangs khri mang po bsdu gi yod red/_khyod rang sdug srog 'di/__,https://d38pmlk0v88drf.cloudfront.net/wav16k/STT_MV0041_0239_1629539_to_1636366.wav,STT_MV,3,146,6.827,wav16k/STT_MV0041_0239_1629539_to_1636366.wav,སྐུ་ངོ་ངའི་མཛུག་གུ་དེར་བཅསག་ལྟོས་ད། ཉིན་ལྟར་རེ་བཞིན་ལྡུམ་རྩིས་འཐེན་རྩིས་བརྒྱབ་བྱས་གསེར་སྲང་ཁྲི་མང་པོ་བསྡུག་ག་ཡོད་རེད། ཁྱེད་རའི་སྡུག་སྲོག་འདེ་
STT_MV0041_0242_1647422_to_1649487,དངུལ་ཏོག་ཙི་ཡོད་ཙང་། ཞེ་བོ་གཅིག་ཡིན་བསམ་ག་བྱས།  ,dngul tog tsi yod tsang /_zhe bo gcig yin bsam ga byas/__,https://d38pmlk0v88drf.cloudfront.net/wav16k/STT_MV0041_0242_1647422_to_1649487.wav,STT_MV,3,48,2.065,wav16k/STT_MV0041_0242_1647422_to_1649487.wav,དངུལ་ཏོག་ཙི་ཡོད་ཙང་ཞེ་བོ་གཅིག་ཡིན་བསམ་ཁ་བྱས།
STT_MV0041_0248_1674921_to_1681993,ཚང་མ་ཁྱེད་རང་གིས་བཟོས་སོང་། དངུལ་མེད་པ། ཞལ་ལག་མཆོད་ག་ཕེབས། ང་ན་ཚ་བལྟས་བྱས། དངུལ་བཙལ་ཀ་བཏང་།  ,tshang ma khyed rang gis bzos song /_dngul med pa/_zhal lag mchod ga phebs/_nga na tsha bltas byas/_dngul btsal ka btang /__,https://d38pmlk0v88drf.cloudfront.net/wav16k/STT_MV0041_0248_1674921_to_1681993.wav,STT_MV,3,93,7.072,wav16k/STT_MV0041_0248_1674921_to_1681993.wav,ཚང་མ་ཁྱེད་རང་གིས་བཟོས་སོང་། དངུལ་མེད་པར་ཞལ་ལག་མཆོད་ག་ཕེབས། ང་ན་ཚ་བལྟས་བྱས་དངུལ་བཙལ་ག་བཏང་།
STT_MV0041_0250_1695026_to_1702631,ཨོ་རེད། དྷི་ཧོས། ལགས་འོ། རང་དངོས་གནས། ཉོ་ཆ་བཟེད་མྱི་འདི་འདྲས་རེད་ཤག རང་གདོང་དེར་གཅིག་ལྟོས་ད། ཉོ་ཆ་བཟེད་དང་བཟེད ,o red/_d+hi hos/_lags 'o/_rang dngos gnas/_nyo cha bzed myi 'di 'dras red shag_rang gdong der gcig ltos da/_nyo cha bzed dang bzed_,https://d38pmlk0v88drf.cloudfront.net/wav16k/STT_MV0041_0250_1695026_to_1702631.wav,STT_MV,3,111,7.605,wav16k/STT_MV0041_0250_1695026_to_1702631.wav,འོ་རེད་དྷི་ཧོས། ལག། རང་དངོས་གནས་ཉོ་ཆ་བཟེད་མྱི་དེ་འདྲས་རེད་ཤག རང་གི་གདོང་འདེར་གཅིག་ལྟོས་ད། ཉོ་ཆ་བཟེད་དང་བཟེད།
STT_MV0041_0251_1702631_to_1712061,ངའི་གདོང་གིས་ག་རེ་བྱས་འདུག ལྟོས་ད། རང་གི་ཨམ་ཅོག་ ག་བར་ཡོད་ཨ། ཨམ་ཅོག་ཆུང་ཆུང་འདི་འདྲས་ངས་ག་འདྲས་སེ་བལྟས་ནས་ཡག་པོ་གཅིག་ཡ་མཐོང་གི་མི་འདུག་བ།  ,nga'i gdong gis ga re byas 'dug_ltos da/_rang gi am cog _ga bar yod a/_am cog chung chung 'di 'dras ngas ga 'dras se bltas nas yag po gcig ya mthong gi mi 'dug ba/__,https://d38pmlk0v88drf.cloudfront.net/wav16k/STT_MV0041_0251_1702631_to_1712061.wav,STT_MV,3,139,9.43,wav16k/STT_MV0041_0251_1702631_to_1712061.wav,ངའི་གདོང་གིས་ག་རེ་བྱས་འདུག ལྟོས་ད། རང་གི་ཨམ་ཆོག་ག་བར་ཡོད་ཨ། ཨམ་ཆོག་ཆུང་ཆུང་འདེ་འདྲས་ངས་ག་འདྲས་སེ་བལྟས་ནས་ཡག་པོ་གཅིག་མཐོང་གི་མི་འདུག་ག
STT_MV0041_0252_1712061_to_1716860,ཁྱེད་རང་སྙན་ཅོག་ཆེན་པོ་ཡོད་ནས། ཨ་ཅག་ལགས་ཀིས། སྐུ་ཤོགས་ཁོང་ལ་གཅིག་གཟིགས་ད།  ,khyed rang snyan cog chen po yod nas/_a cag lags kis/_sku shogs khong la gcig gzigs da/__,https://d38pmlk0v88drf.cloudfront.net/wav16k/STT_MV0041_0252_1712061_to_1716860.wav,STT_MV,3,75,4.799,wav16k/STT_MV0041_0252_1712061_to_1716860.wav,ཁྱེད་རང་སྙན་ཅོག་ཆེན་པོ་ཡོད་ནས་ཨ་ཅག་ལགས་ཀིས། སྐུ་ཤོགས་ཁོང་ལ་གཅིག་གཟིགས་ད།
STT_MV0041_0254_1726304_to_1734835,དངོས་གནས། བསོད་ནམས་བསགས་པའི་རྟགས་མཚན་རེད་ད། ཧེ་ཧེ་ཧེ། རེད་པེ་ལགས། ཧུམ། ཨ་ཨ།  ,dngos gnas/_bsod nams bsags pa'i rtags mtshan red da/_he he he/_red pe lags/_hum/_a a/__,https://d38pmlk0v88drf.cloudfront.net/wav16k/STT_MV0041_0254_1726304_to_1734835.wav,STT_MV,3,77,8.531,wav16k/STT_MV0041_0254_1726304_to_1734835.wav,དངོས་གནས་བསོད་ནམས་བསགས་པའི་རྟགས་མཚན་རེད་ད། ཧ་ཧ རེད་པེ་ལགས།
STT_MV0041_0255_1734835_to_1744181,ང་ལ་བཀའ་མོལ་ཞིག་ཡོད། ཞུས་ན་འགྲིག་ཨ་ཡོང་། ཨ་ གསུངས་ད། ཁྱེད་རང་སྙན་ཅོག་ལ་ཞིབ་ཚགས་ལྟ་དུས།  ,nga la bka' mol zhig yod/_zhus na 'grig a yong /_a _gsungs da/_khyed rang snyan cog la zhib tshags lta dus/__,https://d38pmlk0v88drf.cloudfront.net/wav16k/STT_MV0041_0255_1734835_to_1744181.wav,STT_MV,3,88,9.346,wav16k/STT_MV0041_0255_1734835_to_1744181.wav,ངར་བཀའ་མོལ་ཞིག་ཡོད། ཞུས་ན་འགྲིག་ཨ་ཡོང་།གསུངས་ད། ཁྱེད་རང་སྙན་ཕྱོག་ལ་ཞིབ་ཚགས་ལྟ་དུས།
STT_MV0041_0238_1619540_to_1629539,དེ་དུས། སྲོག་བསྐྱལ་ཡོང་། གཏེ་རྐྱལ་ཁྱོད་རས་ཡིན་ན། ད་དུང་ཁ་རྒྱགས་རུ་བཏང་ག་བྱས། ངས་འདུག་སེ་བལྟས་དུས་ཁྱོད་རས་ང་མཆེད་མངགས་ཀྱག་ཀྱག་བྱེད་ཀི་ཡོད་པ་འདྲ། ཧུན།  ,de dus/_srog bskyal yong /_gte rkyal khyod ras yin na/_da dung kha rgyags ru btang ga byas/_ngas 'dug se bltas dus khyod ras nga mched mngags kyag kyag byed ki yod pa 'dra/_hun/__,https://d38pmlk0v88drf.cloudfront.net/wav16k/STT_MV0041_0238_1619540_to_1629539.wav,STT_MV,3,150,9.999,wav16k/STT_MV0041_0238_1619540_to_1629539.wav,དེ་དུས་སྲོག་སྐྱེལ་ཡོང་། ཧེན། གཏས་རྐྱལ་ཁྱོད་རང་ཡིན་ན། ད་དུང་ཁ་རྒྱགས་རུ་གཏང་ག་བྱས། ངས་འདུག་སེ་བལྟད་དུས་ཁྱོད་རས་ང་ཆེད་མངགས་ཀྱག་ཀྱག་བྱེད་ཀི་ཡོད་པ་འདྲ། ཧེན།
STT_MV0041_0243_1649487_to_1657451,མི་ལ་མགོ་སྐོར་བཏང་བཞག་པ་ཤ་ཅིག་མ་རེད་པེ། རྗེས་མ་ལས་རྒྱུ་འབྲས་འཁོར་སོང་ན། སྡུག་གྱོང་བྱས། སྡུག་གྱོང་བྱས། ཡ་ཡ། ཁྱོད་རང་ད་དུང་ཁ་བདེ་པོ་ཡོད། ངས་ཁྱེད་རང་ངས་གསད་ཤག་དགོས། ཀྱེ།  ,mi la mgo skor btang bzhag pa sha cig ma red pe/_rjes ma las rgyu 'bras 'khor song na/_sdug gyong byas/_sdug gyong byas/_ya ya/_khyod rang da dung kha bde po yod/_ngas khyed rang ngas gsad shag dgos/_kye/__,https://d38pmlk0v88drf.cloudfront.net/wav16k/STT_MV0041_0243_1649487_to_1657451.wav,STT_MV,3,168,7.964,wav16k/STT_MV0041_0243_1649487_to_1657451.wav,མི་ལ་མགོ་སྐོར་བཏང་བཞག་པ་ི་ཆ་གཅིག་མ་རེད་པེ། རྗེས་མ་ལས་རྒྱུ་འབྲས་འཁོར་སོང་ན། སྡུག་གྱོང་གྱིས། སྡུག་གྱོང་གྱིས་བྱས། ཡ། ཁྱེད་རང་ད་དུང་ཁ་བདེ་མོ་ཡོང་། ངས་ཁྱེད་རང་གཉིས་བསད་བཞག་དགོས་ཀེ།
STT_MV0041_0253_1716860_to_1726304,སྐུ་ཤོགས་ཁོང་གི་སྙན་ཅོག་ལ་དངོས་གནས་ཞུ་དགོས་ཡ་མི་འདུག་བ། ཁོང་གི་སྙན་ཅོག་འདི། ཆེན་པོ་དགོས་ན་ཆེན་པོ་འདུག རིང་པོ་དགོས་ན་རིང་པོ་འདུག ,sku shogs khong gi snyan cog la dngos gnas zhu dgos ya mi 'dug ba/_khong gi snyan cog 'di/_chen po dgos na chen po 'dug_ring po dgos na ring po 'dug_,https://d38pmlk0v88drf.cloudfront.net/wav16k/STT_MV0041_0253_1716860_to_1726304.wav,STT_MV,3,128,9.444,wav16k/STT_MV0041_0253_1716860_to_1726304.wav,སྐུ་ཤོགས་ཁོང་གི་སྙན་ཅོག་ལ་དངོས་གནས་ཞུ་དགོས་ཡ་མི་འདུག་ག ཁོང་གི་སྙན་ཅོག་འདེ་ཆེན་པོ་དགོས་ན་ཆེན་པོ་འདུག རིང་པོ་དགོས་ན་རིང་པོ་འདུག
