file_name,uni,wylie,url,dept,grade,char_len,audio_len,path,inf
STT_AB00247_0064_488165_to_499232,ངའི་སེམས་ལ་ཡ་པ་ཕར་གོ་རྟོགས་ཡོད་མ་རེད་བསམ་བྱུང་། ཡིན་ནས་ལས་པ་ཕས་ཁོང་ཁྲོ་ཟ་ཐག་ཆོད་བྱས་ངའི་ས་ལ་ཡ་སླེབས་བྱུང་། ཞེས་བཤད། ཐོག་མར་ལྷག་རྡོར་གྱིས་སྒྲོལ་མའི་སྐད་ཆ་འབྲེལ་མེད་དེ་དག་ཉན་འདོད་མེད་ན་ཡང་།  ,nga'i sems la ya pa phar go rtogs yod ma red bsam byung /_yin nas las pa phas khong khro za thag chod byas nga'i sa la ya slebs byung /_zhes bshad/_thog mar lhag rdor gyis sgrol ma'i skad cha 'brel med de dag nyan 'dod med na yang /__,https://d38pmlk0v88drf.cloudfront.net/wav16k/STT_AB00247_0064_488165_to_499232.wav,STT_AB,3,189,11.067,wav16k/STT_AB00247_0064_488165_to_499232.wav,ངའི་སེམས་ལ་ཡ་པ་ཕར་གོ་རྟོགས་ཡོད་མ་རེད་བསམ་བྱུང་། ཡིན་ནས་ལས་པ་ཕས་ཁོང་ཁྲོ་ཟ་ཐག་ཆོད་བྱས་ངའི་ས་ལ་ཡ་སླེབས་བྱུང་ཞེས་བཤད། ཐོག་མར་ལྷག་རྡོར་གྱིས་སྒྲོལ་མའི་སྐད་ཆ་འདྲེལ་མེད་དེ་དག་ཉན་འདོད་མེད་ན་ཡང་
STT_AB00247_0080_610173_to_620179,ཡིན་པ་བྱས། ཚེ་བརྟན་ལྷ་མོ་ནི་སྐུ་དྲག་གི་བུ་མོ་མ་ཡིན་ལ། རིགས་རུས་མཐོ་པོ་གང་མིན་ཚད་རེད་ཅེས་ཤོད་རྒྱུ་མེད་པར། མོ་ནི་ཁྱིམ་ཚང་ཕལ་པའི་བུ་མོ་ཞིག་ཡིན་མོད།  ,yin pa byas/_tshe brtan lha mo ni sku drag gi bu mo ma yin la/_rigs rus mtho po gang min tshad red ces shod rgyu med par/_mo ni khyim tshang phal pa'i bu mo zhig yin mod/__,https://d38pmlk0v88drf.cloudfront.net/wav16k/STT_AB00247_0080_610173_to_620179.wav,STT_AB,3,146,10.006,wav16k/STT_AB00247_0080_610173_to_620179.wav,པ་བྱས། ཚེ་བརྟན་ལྷ་མོ་ནི་སྐུ་དྲག་གི་བུ་མོ་མ་ཡིན་ལ་ རིགས་རུས་མཐོ་པོ་གང་མིན་ཚད་རེད་ཅེས་ཤོད་རྒྱུ་མེད་པར་མོ་ནི་ཁྱིམ་ཚང་ཕལ་པའི་བུ་མོ་ཞིག་ཡིན་མོད།
STT_AB00247_0065_499232_to_510298,སྒྲོལ་མས་རང་ཉིད་ཀྱི་སྐོར་ཤོད་སྐབས་ཁོ་ལ་སྐད་ཆ་ཉན་འདོད་བྱུང་ནས་མོའི་སྐད་ཆའི་བར་མཚམས་མ་བཅད་པར་མུ་མཐུད་ཉན་སྐབས། ཆེད་མངགས་ཀྱག་ཀྱག་བྱེད་པ་ལྟར་སྒྲོལ་མས་སྐད་ཆ་དེ་དག་ཤོད་མཚམས་བཞག ,sgrol mas rang nyid kyi skor shod skabs kho la skad cha nyan 'dod byung nas mo'i skad cha'i bar mtshams ma bcad par mu mthud nyan skabs/_ched mngags kyag kyag byed pa ltar sgrol mas skad cha de dag shod mtshams bzhag_,https://d38pmlk0v88drf.cloudfront.net/wav16k/STT_AB00247_0065_499232_to_510298.wav,STT_AB,3,170,11.066,wav16k/STT_AB00247_0065_499232_to_510298.wav,སྒྲོལ་མས་རང་ཉིད་ཀྱི་སྐོར་ཤོད་སྐབས་ཁོ་ལ་སྐད་ཆ་ཉན་འདོད་བྱུང་ནས་མོའི་སྐད་ཆའི་བར་མཚམས་མ་བཅད་པར་མུ་མཐུད་ཉན་སྐབས་ཆེད་མངགས་ཀྱག་ཀྱག་བྱེད་པ་ལྟར་སྒྲོལ་མས་སྐད་ཆ་དེ་དག་ཆོད་མཚམས་བཞག
STT_AB00247_0067_518813_to_525827,སྐད་ཆ་ཤོད་རྩིས་མི་བྱེད་སྟབས། ཁོ་སེམས་འཚབ་སྐྱེས་ནས་དེ་ནས་ག་རེ་བཤད་བྱུང་། ཞེས་དྲིས་པར་སྒྲོལ་མས་ཀྱང་རྐང་བཙུགས་ནས་ ,skad cha shod rtsis mi byed stabs/_kho sems 'tshab skyes nas de nas ga re bshad byung /_zhes dris par sgrol mas kyang rkang btsugs nas _,https://d38pmlk0v88drf.cloudfront.net/wav16k/STT_AB00247_0067_518813_to_525827.wav,STT_AB,3,111,7.014,wav16k/STT_AB00247_0067_518813_to_525827.wav,སྐད་ཆ་ཤོད་རྩིས་མི་བྱེད་སྟབས་ཁོ་སེམས་འཚབ་བསྐྱེས་ནས་དེ་ནས་ག་རེ་བཤད་བྱུང་ཞེས་དྲིས་པར་སྒྲོལ་མས་ཀྱང་རྐང་བཙུགས་ནས་
STT_NS_M0342_0185_1226582_to_1232158,དེའི་སྔོན་ཡིན་ན་ཨོ་དེ་ཧ་གོ་གི་མི་འདུག་ཅིག་ཡོད་བ། ཨེ་ནས་གཞན་པ་འདྲ་བོ་མི་ད་ཨོ་ཨེ་འདྲའི་རེད་ཤག མིས་ལྟ་སྟངས།  ,de'i sngon yin na o de ha go gi mi 'dug cig yod ba/_e nas gzhan pa 'dra bo mi da o e 'dra'i red shag_mis lta stangs/__,https://d38pmlk0v88drf.cloudfront.net/wav16k/STT_NS_M0342_0185_1226582_to_1232158.wav,STT_NS,3,106,5.576,wav16k/STT_NS_M0342_0185_1226582_to_1232158.wav,དེའི་སྔན་ཡིན་ན་ཨོ་དེ་ཧ་གོ་ཡི་མི་འདུག་ཅིག་ཡོད་བ། ཨེ་ནས་གཞན་པ་འདྲ་བོ་མི་ད་ཨོ་ཨེ་འདྲའི་རེད་ཤག མི་ལྟ་སྟངས།
STT_NS_M0342_0195_1285025_to_1289530,ཨེ་ནས་ཁ་སང་ཏོག་ཙི་སྔོན་ནས་ང་རང་གཉིས་བར་རོལ་ལ་ལྗིད་ཁོག་འདྲ་བོ་ཅིག ,e nas kha sang tog tsi sngon nas nga rang gnyis bar rol la ljid khog 'dra bo cig_,https://d38pmlk0v88drf.cloudfront.net/wav16k/STT_NS_M0342_0195_1285025_to_1289530.wav,STT_NS,3,65,4.505,wav16k/STT_NS_M0342_0195_1285025_to_1289530.wav,ཨེ་ནས་ཁ་སང་ཏིས་ཙི་སྔོན་ནས་ང་རང་གཉིས་བར་རོ་ལ་ལྗིད་ཁོག་འདྲ་བོ་ཅིག
STT_AB00247_0075_569906_to_578489,མ་ཟད་ང་རང་གཉིས་མཐུན་པོ་བྱུང་ན་ད་གས་འགྲིག་གི་མ་རེད་བས། ཞེས་བཤད། ལྷག་རྡོར་གྱི་གདོང་ལ་དགའ་སྡུག་གི་རྣམ་འགྱུར་མེད་ན་ཡང་། ཁོའི་སེམས་ལ་རང་ ,ma zad nga rang gnyis mthun po byung na da gas 'grig gi ma red bas/_zhes bshad/_lhag rdor gyi gdong la dga' sdug gi rnam 'gyur med na yang /_kho'i sems la rang _,https://d38pmlk0v88drf.cloudfront.net/wav16k/STT_AB00247_0075_569906_to_578489.wav,STT_AB,3,132,8.583,wav16k/STT_AB00247_0075_569906_to_578489.wav,མ་ཟད་ང་རང་གཉིས་མཐུན་པོ་བྱུང་ན་ད་གས་འགྲིག་གི་མ་རེད་པས་ཞེས་བཤད། ལྷག་རྡོར་གྱི་གདོང་ལ་དགའ་སྡུག་གི་རྣམ་འགྱུར་མེད་ན་ཡང་ཁོའི་སེམས་ལ་རང་
STT_AB00267_0067_574564_to_584633,དར་ཚོན་སྣ་ལྔའི་དར་ལྕོག་བཙུགས་ཡོད་པ་རྣམས་ཞོགས་པའི་ལྷགས་བསིལ་གྱིས་དལ་བུར་སྐྱོད་ཚུལ་ལ་བལྟས་པ་ཙམ་གྱིས། གྲོང་ཚོ་དེ་ནི་དེ་འདྲས་ཞི་འཇམ་པ་དང་། བདེ་ལུས་དུ་གནས་པ་ཞིག་ཐུབ།  ,dar tshon sna lnga'i dar lcog btsugs yod pa rnams zhogs pa'i lhags bsil gyis dal bur skyod tshul la bltas pa tsam gyis/_grong tsho de ni de 'dras zhi 'jam pa dang /_bde lus du gnas pa zhig thub/__,https://d38pmlk0v88drf.cloudfront.net/wav16k/STT_AB00267_0067_574564_to_584633.wav,STT_AB,3,162,10.069,wav16k/STT_AB00267_0067_574564_to_584633.wav,བར་ཚོན་སྣ་ལྔའི་དར་ལྕོག་བཙུགས་ཡོད་པ་རྣམས་ཞོགས་པའི་ལྷག་སིལ་གྱིས་དལ་བུར་བསྐྱོད་ཚུལ་ལ་བལྟས་པ་ཙམ་གྱིས་གྲོང་ཚོ་དེ་ནི་དེ་འདྲའི་གཞི་འཇམ་པ་དང་བདེ་ལྷོད་དུ་གནས་པ་ཤེས་ཐུབ།
STT_NS_M0342_0212_1413694_to_1421407,རེ་ལའེ་ཤོན་ཝོརཁྀ་བྱེད་ཡ་ལ་ཡོད་བ། ཨེ་ནས་ཧན་ཌརཌྀ་ཕྀར་སནཋྀ་ད་དུང་འགྲོ་གི་མི་འདུག་ན། ཕར་ཕྱོགས་དེས་སྤྱོད་པ་སློག་བསྡད་ན། ཨའོཋྀ་ཡིན་ན་ཨའོཋྀ་བཏང་ལབ་ཡ་ཅིག་ཡོད་བ།  ,re la'e shon worakh-i byed ya la yod ba/_e nas han DaraD-i ph-ir sanaTh-i da dung 'gro gi mi 'dug na/_phar phyogs des spyod pa slog bsdad na/_a'oTh-i yin na a'oTh-i btang lab ya cig yod ba/__,https://d38pmlk0v88drf.cloudfront.net/wav16k/STT_NS_M0342_0212_1413694_to_1421407.wav,STT_NS,3,154,7.713,wav16k/STT_NS_M0342_0212_1413694_to_1421407.wav,ཨ་ལེ་རི་ལའེ་ཤོན་ཝོརཁྀ་བྱེད་ཡ་ལ་ཡོད་བ། ཨེ་ནས་ཧན་ཌྀར་ཕྀར་སན་ད་དུང་འགྲོ་གི་མི་འདུག་ད། ཕར་ཕྱོགས་དེ་སྤྱོད་པ་སློག་འདུག་ན་ཨའོཌྀ་ཡིན་ན་ཨོཌྀ་བཏང་ལབ་ཡ་ཅིག་ཡོད་བ།
STT_NS_M0342_0223_1490008_to_1492380,འགྲམ་ལ་ཡོད་རྒྱོ་མི་དེ་ཚོ་དཀའ་ལས་ཡོད་རེད། ད་ཐག་རིང་པོ་ད་ཡོད་བ་རཱ་ད།  ,'gram la yod rgyo mi de tsho dka' las yod red/_da thag ring po da yod ba rA da/__,https://d38pmlk0v88drf.cloudfront.net/wav16k/STT_NS_M0342_0223_1490008_to_1492380.wav,STT_NS,3,68,2.372,wav16k/STT_NS_M0342_0223_1490008_to_1492380.wav,འགྲམ་ལ་ཡོད་རྒྱོ་མི་དེ་ཚོ་དཀའ་ལས་ཡོད་རེད། ད་ཐག་རིང་པོ་ད་ཡོད་བ་རཱ་ད།
STT_NS_M0342_0220_1460315_to_1466359,ཏག་ཏག་ཌེ་ཟྀར་ཧྦིང་འདྲ་བོ་འདུག་བསམ་ན་གསར་བ་དེ་ཚོ་ཅིག་ཡོད་ར། སོ་སོའང་རེ་ལའེ་ཤོན།  ,tag tag De z-ir h+bing 'dra bo 'dug bsam na gsar ba de tsho cig yod ra/_so so'ang re la'e shon/__,https://d38pmlk0v88drf.cloudfront.net/wav16k/STT_NS_M0342_0220_1460315_to_1466359.wav,STT_NS,3,80,6.044,wav16k/STT_NS_M0342_0220_1460315_to_1466359.wav,ཏག་ཏག་ཌི་སཱ་བྷིང་འདྲ་བོ་འདུག་བསམ་ན་གསར་བ་དེ་ཚོ་གཅིག་ཡོད་རཱ། སོ་སོ་ཡང་ཡང་རྀལའེ་ཤོན།
STT_PC0098_0049_415640_to_420888,ཧོང་ཀོང་ནང་ལ་ཐག་གཅོད་བྱས་པ་དེ་རྒྱ་ནག་ནང་ལག་ལེན་བསྟར་ཡ་ཡོད་པ་དང་། རྒྱ་ནག་ནང་ཐག་གཅོད་བྱས་པ་དེ་ཡིན་ན་ཧོང་ཀོང་ནང་ལག་ལེན་བསྟར་ཡ་ཡོད་པ་ ,hong kong nang la thag gcod byas pa de rgya nag nang lag len bstar ya yod pa dang /_rgya nag nang thag gcod byas pa de yin na hong kong nang lag len bstar ya yod pa _,https://d38pmlk0v88drf.cloudfront.net/wav16k/STT_PC0098_0049_415640_to_420888.wav,STT_PC,3,130,5.248,wav16k/STT_PC0098_0049_415640_to_420888.wav,ཧོང་ཀོང་ནང་ཐག་གཅོད་བྱས་པ་དེ་རྒྱ་ནག་ནང་ལག་ལེན་བསྟར་ཡ་ཡོད་པ་ཙང་། རྒྱ་ནག་ནང་ཐག་གཅོད་བྱས་པ་དེ་ཡིན་ན། ཧོང་ཀོང་ནང་ལག་ལེན་བསྟར་ཡ་ཡོད་པ།
STT_NS_M0342_0207_1376988_to_1382858,ད་བསླབ་བྱ་ཡག་ཤོས་འདྲ་བོ་ག་རེ་མཐོང་སོང་ལབ་ན། དགའ་བོ་དངོས་གནས་བྱེད་དུས་ལ་རེད་དཱ། སོ་སོས་བྷའེསྀཋྀ་སྤྲད་རཱ། ཧན་ཌརཌྀ་ཕྀར་སནཋྀ།  ,da bslab bya yag shos 'dra bo ga re mthong song lab na/_dga' bo dngos gnas byed dus la red dA/_so sos b+ha'es-iTh-i sprad rA/_han DaraD-i ph-ir sanaTh-i/__,https://d38pmlk0v88drf.cloudfront.net/wav16k/STT_NS_M0342_0207_1376988_to_1382858.wav,STT_NS,3,122,5.87,wav16k/STT_NS_M0342_0207_1376988_to_1382858.wav,ད་བསླབ་བྱ་ཡག་ཤོས་འདྲ་བོ་ག་རེ་མཐོང་སོང་ལབ་ན། དགའ་བོ་དངོས་གནས་བྱས་ཡོད་དུས་ལབ་རེད་ད། སོ་སོ་བྷའེསྀཋྀ་སྤྲད་རཱ་ ཧན་ཌྀར་བྷྀར་སན།
STT_NS_M0342_0208_1383080_to_1390607,ཧན་ཌརཌྀ་ཕྀཪ་སནཋྀ་བྷའེསྀཋྀ་སྤྲད་རཱ། ཨེ་ནས་ཕར་ཕྱོགས་དེ་ཡོད་བ། ད་དུས་ཚོད་ད་དེང་སང་དུས་ཚོད་ལ་དཀའ་ངལ་མང་པོ་འཕྲད་ཀི་འདུག་བ། དམིགས་བསལ།  ,han DaraD-i ph-iRa sanaTh-i b+ha'es-iTh-i sprad rA/_e nas phar phyogs de yod ba/_da dus tshod da deng sang dus tshod la dka' ngal mang po 'phrad ki 'dug ba/_dmigs bsal/__,https://d38pmlk0v88drf.cloudfront.net/wav16k/STT_NS_M0342_0208_1383080_to_1390607.wav,STT_NS,3,130,7.527,wav16k/STT_NS_M0342_0208_1383080_to_1390607.wav,ཁན་ཌྀར་ཕྀར་སིནྀ་བྷའེསྀཋྀ་སྤྲད་རཱ། ཨེ་ནས་ཕར་ཕྱོགས་དེ་ཡོད་བ། ད་དུས་ཚོད་ད་དེང་སང་དུས་ཚོད་ལ་དཀའ་ངལ་མང་པོ་འཕྲད་ཀི་འདུག་བ། དམིགས་བསལ།
STT_NS_M0342_0210_1398134_to_1405661,ཨེ་འདྲའི་འདྲ་བོ་མང་པོ་མཐོང་སོང་རཱ། ཡིན་ནས་ད་ང་ག་རེ་ལབ། ང་ག་རེ་འདྲ་བོ་མཐོང་གི་འདུག་ལབ་ན། སོ་སོ་ཧན་ཌརཌྀ་ཕྀཪ་སནཋྀ་སྤྲད་རཱ། བྷའེ་སྀཋྀ་དེ་སྤྲད་རཱ། ཕར་ཕྱོགས་སྤྱོད་པ་དང་ཅིག ,e 'dra'i 'dra bo mang po mthong song rA/_yin nas da nga ga re lab/_nga ga re 'dra bo mthong gi 'dug lab na/_so so han DaraD-i ph-iRa sanaTh-i sprad rA/_b+ha'e s-iTh-i de sprad rA/_phar phyogs spyod pa dang cig_,https://d38pmlk0v88drf.cloudfront.net/wav16k/STT_NS_M0342_0210_1398134_to_1405661.wav,STT_NS,3,165,7.527,wav16k/STT_NS_M0342_0210_1398134_to_1405661.wav,ཨེ་འདྲའི་འདྲ་བོ་མང་པོ་མཐོང་སོང་རཱ། ཡིན་ནས་ད་ང་ག་ལབ། ང་ག་རེ་འདྲ་བོ་མཐོང་གི་འདུག་ལབ་ན། སོ་སོ་ཧན་ཌྀར་ཕྀར་སནཋྀ་སྤྲད་རཱ། བྷའེསྀ་ཐྀ་སྤྲད་རཱ། ཕར་ཕྱོགས་སྤྱོད་པ་དང་ཅིག
STT_NS_M0342_0221_1466359_to_1472403,ཏིས་ཙི་ཡར་རྒྱས་འགྲོ་གི་རེད་བ། ཨོ་ཨེ་འདྲའི་འདྲ་བོ་ད་ཨོ། ཨོ་ཨེ་འདྲའི་འདྲ་བོ་རེད་ཤག་རཱ། སོ་སོ་ཨེ་མོ་ཤོན་ནཱལ་ཧན་ཌལ་བྱེད་ཡ་དང་དེ་ཚོ་གལ་ཆེན་པོ་རེད་ཤག་ཡོད་བ།  ,tis tsi yar rgyas 'gro gi red ba/_o e 'dra'i 'dra bo da o/_o e 'dra'i 'dra bo red shag rA/_so so e mo shon nAl han Dal byed ya dang de tsho gal chen po red shag yod ba/__,https://d38pmlk0v88drf.cloudfront.net/wav16k/STT_NS_M0342_0221_1466359_to_1472403.wav,STT_NS,3,152,6.044,wav16k/STT_NS_M0342_0221_1466359_to_1472403.wav,ཏོག་ཙི་ཡར་རྒྱས་འགྲོ་གི་རཱ། ཨོ་ཨེ་འདྲའི་འདྲ་བོ་ད་ཨོ་ཨེ་འདྲའི་འདྲ་བོ་རེད་ཤག་རཱ། སོ་སོ་ཨེ་མོ་ཤོ་ནལ་ཧན་ཋལ་བྱེད་ཡ་དང་དེ་ཚོ་གལ་ཆེན་པོ་རེད་ཤག་ཡོད་བ།
STT_NS_M0342_0206_1367579_to_1376054,དགའ་གི་འདུག་འདྲ་བོ་ལབ་ཀི་མེད་ད། ད་ག་སེ་ཧྥྀལྀར་ཊིང་འདྲ་བོ་བྱས་རཱ། ཨེ་ནས་ཏིས་སི་ཨེ་འདྲའི་བསྡད་བཞག་ཡ་ཅིག་ཡོད་བ། ཅིག་ཡོད་བ། ཨེ་འདྲའི་ཞེ་བོ་ཞེ་བོ་ཏིས་སི། ཨོ་ཨེ་འདྲའི་འདྲ་བོ་རེད་ཡོད་བ། ད་ང་།  ,dga' gi 'dug 'dra bo lab ki med da/_da ga se h+ph-il-ir Ting 'dra bo byas rA/_e nas tis si e 'dra'i bsdad bzhag ya cig yod ba/_cig yod ba/_e 'dra'i zhe bo zhe bo tis si/_o e 'dra'i 'dra bo red yod ba/_da nga /__,https://d38pmlk0v88drf.cloudfront.net/wav16k/STT_NS_M0342_0206_1367579_to_1376054.wav,STT_NS,3,186,8.475,wav16k/STT_NS_M0342_0206_1367579_to_1376054.wav,དགའ་གི་འདུག་འདྲ་བོ་ལབ་ཀི་མེད་ད། ད་ག་སེ་ཧྥྀརཱ་ཌིང་འདྲ་བོ་བྱས་རཱ། ཨེ་ནས་ཏིས་ཙི་ཨེ་འདྲའི་བསྡད་བཞག་ཡ་ཅིག་ཡོད་བ། ཅིག་ཡོད་བ། ཨེ་འདྲའི་ཞེ་བོ་ཞེ་བོ་ཏིས་ཙི་ཨོ་ཨེ་འདྲའི་འདྲ་བོ་རེད་ཡོད་བ། ད་ང་།
STT_AB00247_0079_600167_to_610173,སྒྲོལ་མ་སྐུ་དྲག་གི་བུ་མོ་ལྟ་བ་མཐོ་པོ་ཞིག་ཡིན་ན། ངས་བཙན་ཤེད་ཀྱིས་མོ་ལ་འོ་བྱེད་པ་དང་། མཆིལ་མ་མོའི་ཁའི་ནང་འཕེན་རྒྱུ་བྱུང་ན་ཅི་མ་རུང་སྙམ་ན་ཡང་། དེ་རྣམས་སྒྲོལ་མའི་མདུན་དུ་མི་མངོན་ ,sgrol ma sku drag gi bu mo lta ba mtho po zhig yin na/_ngas btsan shed kyis mo la 'o byed pa dang /_mchil ma mo'i kha'i nang 'phen rgyu byung na ci ma rung snyam na yang /_de rnams sgrol ma'i mdun du mi mngon _,https://d38pmlk0v88drf.cloudfront.net/wav16k/STT_AB00247_0079_600167_to_610173.wav,STT_AB,3,175,10.006,wav16k/STT_AB00247_0079_600167_to_610173.wav,སྒྲོལ་མ་སྐུ་དྲག་གི་ཕོ་མོ་ལྟ་བ་མཐོ་པོ་ཞིག་ཡིན་ན་ངས་བཙན་ཤེད་ཀྱིས་མོ་ལ་འོ་བྱེད་པ་དང་མྱི་མ་མོའི་ཁའི་ནང་འཕེན་རྒྱུ་བྱུང་ན་ཅི་མ་རུང་སྙམ་ན་ཡང་། དེ་རྣམས་སྒྲོལ་མའི་མདུན་དུ་མེ་ངོ་
STT_PC0098_0050_423160_to_425336,ད་རེས་ཧང་དཱ་ལྟ་བུ་ཡིན་ན་ཞེ་བོ་ཅིག་ཆེན་པོ་སོང་ཙང་ ,da res hang dA lta bu yin na zhe bo cig chen po song tsang _,https://d38pmlk0v88drf.cloudfront.net/wav16k/STT_PC0098_0050_423160_to_425336.wav,STT_PC,3,49,2.176,wav16k/STT_PC0098_0050_423160_to_425336.wav,ད་རེས་ཧང་ཐཱ་ལྟ་བུ་ཡིན་ན། ཞེ་བོ་ཅིག་ཆེན་པོ་སོང་ཙང་།
STT_NS_M0342_0211_1405661_to_1413188,འགྱུར་གི་འགྲོ་གོ་མེད་ན། ཨེ་ནས་ཞེད་སྣང་མ་བྱེད་ལབ་ཡིན། ཤོར་གི་འདུག་ལབ་ནས་ཡོད་བ། སོ་སོས་ཧན་ཌརཌྀ་ཕྀར་སནཋྀ་སྤྲད།  ,'gyur gi 'gro go med na/_e nas zhed snang ma byed lab yin/_shor gi 'dug lab nas yod ba/_so sos han DaraD-i ph-ir sanaTh-i sprad/__,https://d38pmlk0v88drf.cloudfront.net/wav16k/STT_NS_M0342_0211_1405661_to_1413188.wav,STT_NS,3,109,7.527,wav16k/STT_NS_M0342_0211_1405661_to_1413188.wav,སྒྱུར་གི་འགྲོ་གི་མེད་ན། ཨེ་ནས་ཞེད་སྣང་མ་བྱེད་ལབ་ཡ་ཤོར་གི་འདུག་ལབ་ནས་ཡོད་བ། སོ་སོ་ཨན་ཋྀར་ཕྀར་སྀནཋྀ་སྤྲད།ཨེ།
STT_NS_M0342_0209_1390607_to_1398134,ད་དེང་སང་དུས་ཚོད་ལ་བུ་མང་བ་མྱང་རྒྱོ་འདྲ་བོ་མཐོང་སོང་རེད་བ། དགའ་བོ་ལ། བུ་མོ་གིས་ཅིག་ཆི་ཌིང་བྱེད་ཡ་འདྲ་བོ་དང་། ཡང་མིན་ན་བུ་མོ་ཅིག་ཡོད་རེད་བ། ཨོ་ཨེ་འདྲའི།  ,da deng sang dus tshod la bu mang ba myang rgyo 'dra bo mthong song red ba/_dga' bo la/_bu mo gis cig chi Ding byed ya 'dra bo dang /_yang min na bu mo cig yod red ba/_o e 'dra'i/__,https://d38pmlk0v88drf.cloudfront.net/wav16k/STT_NS_M0342_0209_1390607_to_1398134.wav,STT_NS,3,153,7.527,wav16k/STT_NS_M0342_0209_1390607_to_1398134.wav,ད་དེང་སང་དུས་ཚོད་ལ་བུ་མང་བ་མྱངས་རྒྱོ་འདྲ་བོ་མཐོང་སོང་རཱ། དགའ་བོ་ལ། བུ་མོ་གིས་གཅིག་ཆཱིཋྀ་བྱེད་ཡ་འདྲ་བོ་དང་། ཡང་མིན་ན་བུ་མོ་གཅིག་ཡོད་རཱ། ཨོ་ཨེ་འདྲའི།
STT_AB00247_0087_662687_to_671834,ཉིན་མོའི་ལས་ཐག་བཅད་རྗེས་དུས་ཚོད་རིང་པོ་མ་སོང་གོང་རུ་ཁག་གིས་དྲིལ་བརྡ་བརྡུངས་ནས་ཚོགས་འདུར་སྐད་གཏོང་སྐབས། དེ་བས་སེམས་ཁྲལ་དང་ཐེ་ཚོམ་གྱི་བསམ་པ་འཆང་བཞིན་ ,nyin mo'i las thag bcad rjes dus tshod ring po ma song gong ru khag gis dril brda brdungs nas tshogs 'dur skad gtong skabs/_de bas sems khral dang the tshom gyi bsam pa 'chang bzhin _,https://d38pmlk0v88drf.cloudfront.net/wav16k/STT_AB00247_0087_662687_to_671834.wav,STT_AB,3,148,9.147,wav16k/STT_AB00247_0087_662687_to_671834.wav,ཉིན་མོའི་ལས་ཐག་བཅད་རྗེས་དུས་ཚོད་རིང་པོར་མ་སོང་གོང་རུ་ཁག་གིས་དྲིལ་བརྡ་བརྡུགས་ནས་ཚོགས་འདུར་སྐད་གཏོང་སྐབས་དེ་བས་སེམས་ཁྲལ་དང་ཐེ་ཚོམ་གྱི་བསམ་པ་འཆང་བཞིན་
